{
  "$schema": "http://json-schema.org/draft-07/schema#",
  "$id": "https://raw.githubusercontent.com/StefanGreve/gelyn/master/gelyn.schema.json",
  "title": "Gelyn configuration",
  "description": "Settings gelyn reads from gelyn.json in the working directory, or from the file given to --config.",
  "type": "object",
  "additionalProperties": false,
  "properties": {
    "$schema": {
      "description": "Reference to this schema, so that editors offer completion and validation.",
      "type": "string"
    },
    "Title": {
      "description": "The name of the site.",
      "type": "string",
      "minLength": 1,
      "default": "Gelyn",
      "examples": [
        "Gelyn",
        "My Notebook"
      ]
    },
    "Language": {
      "description": "The language of the generated pages, written to the lang attribute of every document as a BCP 47 tag.",
      "type": "string",
      "minLength": 1,
      "default": "en",
      "examples": [
        "en",
        "en-US",
        "de-DE"
      ]
    },
    "Author": {
      "description": "The name written to the author meta tag. Omitted from the document when absent.",
      "type": ["string", "null"],
      "default": null,
      "examples": [
        "Stefan Greve"
      ]
    },
    "Description": {
      "description": "The description written to the description meta tag by any page whose front matter declares none. Omitted from the document when absent.",
      "type": ["string", "null"],
      "default": null,
      "examples": [
        "Notes on software engineering."
      ]
    },
    "BaseUrl": {
      "description": "The absolute http or https URL the site is served from. Its path prefixes every link, and its origin gives each page a canonical URL.",
      "type": ["string", "null"],
      "format": "uri",
      "default": null,
      "examples": [
        "https://example.com"
      ]
    },
    "KaTeXVersion": {
      "description": "The version of KaTeX requested from jsDelivr by a page whose front matter sets enableMathRendering.",
      "type": "string",
      "minLength": 1,
      "pattern": "^\\d+\\.\\d+\\.\\d+$",
      "default": "0.19.0",
      "examples": [
        "0.19.0"
      ]
    },
    "ContentDirectory": {
      "description": "The directory the site is built from, holding the Markdown sources and anything published beside them. Relative values are resolved against the working directory.",
      "type": "string",
      "minLength": 1,
      "default": "content",
      "examples": [
        "content",
        "src/pages"
      ]
    },
    "OutputDirectory": {
      "description": "The directory the generated site is written to. Relative values are resolved against the working directory. Existing files are overwritten.",
      "type": "string",
      "minLength": 1,
      "default": "_site",
      "examples": [
        "_site",
        "public"
      ]
    },
    "ExcludePatterns": {
      "description": "Patterns naming the entries the build leaves out, matched case insensitively against the name of each file and directory rather than against its path, with * and ? as the only wildcards. A directory that matches is not descended into. Nothing is excluded by default.",
      "type": "array",
      "items": {
        "type": "string",
        "minLength": 1
      },
      "uniqueItems": true,
      "default": [],
      "examples": [
        [
          "*.tmp",
          "drafts",
          "*.xcf"
        ]
      ]
    }
  }
}
